{
  "imports": [
    "os",
    "openai.OpenAI"
  ],
  "functions": [
    {
      "name": "summarize",
      "args": [
        "self",
        "query"
      ],
      "returns": null,
      "docstring": null
    },
    {
      "name": "__init__",
      "args": [
        "self"
      ],
      "returns": "None",
      "docstring": null
    }
  ],
  "classes": [
    {
      "name": "OpenRouterClient",
      "bases": [],
      "methods": [
        "summarize",
        "__init__"
      ],
      "docstring": null
    }
  ],
  "docstrings": {
    "module": null,
    "functions": {
      "summarize": null,
      "__init__": null
    },
    "classes": {
      "OpenRouterClient": null
    }
  },
  "type_hints": {},
  "constants": [],
  "cross_library_functions": {
    "os": {
      "source_file": null,
      "functions": [],
      "classes": [],
      "is_local": false,
      "note": "External library"
    },
    "openai.OpenAI": {
      "source_file": null,
      "functions": [],
      "classes": [],
      "is_local": false,
      "note": "External library"
    }
  },
  "file_name": "openrouter_client.py",
  "summary": "# OpenRouterClient Documentation\n\n## Table of Contents\n\n1. [Overview](#overview)\n2. [Purpose](#purpose)\n3. [High-Level Responsibilities](#high-level-responsibilities)\n4. [Intended Use Cases](#intended-use-cases)\n5. [Architecture & Design](#architecture--design)\n6. [Public Interfaces](#public-interfaces)\n7. [Usage Examples](#usage-examples)\n8. [Edge Cases & Constraints](#edge-cases--constraints)\n9. [Configuration & Environment](#configuration--environment)\n10. [Best Practices & Notes](#best-practices--notes)\n\n## Overview\n\nThe `OpenRouterClient` class is a Python client for interacting with the OpenRouter AI API. It provides a simple interface for sending chat messages and receiving responses.\n\n## Purpose\n\nThe purpose of this file is to provide a convenient way to interact with the OpenRouter AI API, specifically for sending chat messages and receiving responses.\n\n## High-Level Responsibilities\n\n- Initialize the OpenAI client with the provided API key.\n- Send chat messages to the OpenRouter AI API and return the response.\n\n## Intended Use Cases\n\nThis class is intended to be used by other parts of the application that need to interact with the OpenRouter AI API for chat-based tasks.\n\n## Architecture & Design\n\nThe `OpenRouterClient` class uses the `openai` library to interact with the OpenRouter AI API. It initializes the OpenAI client with the provided API key in the constructor and provides a single method, `summarize`, for sending chat messages and receiving responses.\n\n### Key Design Patterns\n\n- Singleton pattern: The `OpenAI` client is initialized only once in the constructor.\n\n### Important Abstractions\n\n- `openai.OpenAI`: The client used to interact with the OpenRouter AI API.\n\n### Dependencies and Integrations\n\n- `openai`: The library used to interact with the OpenRouter AI API.\n\n## Public Interfaces\n\n### `summarize(query: str) -> str`\n\nSends a chat message to the OpenRouter AI API and returns the response.\n\n**Parameters**\n\n- `query` (str): The message to send to the API.\n\n**Returns**\n\n- `str`: The response from the API.\n\n**Exceptions**\n\n- `openai.OpenAIError`: If there is an error communicating with the API.\n\n### `__init__(self) -> None`\n\nInitializes the `OpenAI` client with the provided API key.\n\n**Parameters**\n\n- None\n\n**Returns**\n\n- None\n\n## Internal Logic\n\nThe `summarize` method sends a chat message to the OpenRouter AI API using the `chat.completions.create` method of the `OpenAI` client. It creates a message object with the role of \"user\" and the content set to the provided query. It then creates a completion object with the model set to \"mistralai/mistral-nemo\" and the messages set to a list containing the system message and the user message. The method returns the content of the first choice in the completion object's choices list.\n\n## Configuration & Environment\n\n### Required Environment Variables\n\n- `OPENROUTER_API_KEY`: The API key for the OpenRouter AI API.\n\n### External Services or Resources Used\n\n- OpenRouter AI API: The API used to send chat messages and receive responses.\n\n## Usage Examples\n\n```python\nfrom openrouter_client import OpenRouterClient\n\n# Initialize the client\nclient = OpenRouterClient()\n\n# Send a chat message and receive a response\nresponse = client.summarize(\"What is the capital of France?\")\nprint(response)  # Output: Paris\n```\n\n## Edge Cases & Constraints\n\n- The OpenRouter AI API may have rate limits, which could cause the `summarize` method to raise an `openai.OpenAIError` if exceeded.\n- The `summarize` method assumes that the API will always return a response. If the API does not return a response, the method may raise an unhandled exception.\n\n## Best Practices & Notes\n\n- Always handle exceptions when communicating with external APIs to prevent unexpected failures.\n- Consider implementing retries with exponential backoff for transient errors when communicating with external APIs.\n- Regularly review and update the API key used to authenticate with the OpenRouter AI API to ensure it remains secure.\n- Consider implementing rate limiting to prevent abuse of the OpenRouter AI API.\n- Consider implementing caching to improve performance and reduce API usage."
}
