{"imports": ["json", "ast", "graphviz.Digraph"], "functions": [{"name": "_safe_parse", "args": ["self", "content"], "returns": null, "docstring": null}, {"name": "generateGraph", "args": ["self", "content"], "returns": "None", "docstring": null}, {"name": "extract_imports", "args": ["self", "content"], "returns": "list", "docstring": null}, {"name": "extract_functions", "args": ["self", "content"], "returns": "list", "docstring": null}, {"name": "extract_classes", "args": ["self", "content"], "returns": "list", "docstring": "Return classes with bases, methods and docstring.\n\nReturns list of dicts: {name, bases, methods, docstring}"}, {"name": "extract_docstrings", "args": ["self", "content"], "returns": "dict", "docstring": "Return module docstring and per-symbol docstrings."}, {"name": "extract_type_hints", "args": ["self", "content"], "returns": null, "docstring": "Extract simple type hints from top-level functions.\n\nReturns dict mapping function name to {'args': {arg: annotation}, 'returns': annotation}"}, {"name": "extract_top_level_constants", "args": ["self", "content"], "returns": null, "docstring": "Return module-level simple constants (NAME = Constant).\n\nReturns list of dicts: {name, value_repr}"}, {"name": "extract_todos", "args": ["self", "content"], "returns": null, "docstring": "Return list of comment TODO/FIXME lines with line numbers."}, {"name": "summarize_file", "args": ["self", "content"], "returns": null, "docstring": "Return a combined summary dict for a file using the various extractors."}, {"name": "__init__", "args": ["self"], "returns": "None", "docstring": null}, {"name": "add_node", "args": ["node", "parent"], "returns": null, "docstring": null}], "classes": [{"name": "DependencyGenerator", "bases": [], "methods": ["_safe_parse", "generateGraph", "extract_imports", "extract_functions", "extract_classes", "extract_docstrings", "extract_type_hints", "extract_top_level_constants", "extract_todos", "summarize_file", "__init__"], "docstring": null}], "docstrings": {"module": null, "functions": {"_safe_parse": null, "generateGraph": null, "extract_imports": null, "extract_functions": null, "extract_classes": "Return classes with bases, methods and docstring.\n\nReturns list of dicts: {name, bases, methods, docstring}", "extract_docstrings": "Return module docstring and per-symbol docstrings.", "extract_type_hints": "Extract simple type hints from top-level functions.\n\nReturns dict mapping function name to {'args': {arg: annotation}, 'returns': annotation}", "extract_top_level_constants": "Return module-level simple constants (NAME = Constant).\n\nReturns list of dicts: {name, value_repr}", "extract_todos": "Return list of comment TODO/FIXME lines with line numbers.", "summarize_file": "Return a combined summary dict for a file using the various extractors.", "__init__": null, "add_node": null}, "classes": {"DependencyGenerator": null}}, "type_hints": {}, "constants": [], "file_name": "dependency_generator.py", "summary": "**Summary of the Python Source Code File:**\n\n1. **File Description:** The file contains a Python class named `DependencyGenerator` that uses the Abstract Syntax Tree (AST) to extract and analyze various aspects of Python code, such as imports, functions, classes, docstrings, type hints, and top-level constants.\n\n2. **Imported Libraries:**\n   - `json` and `ast` (built-in)\n   - `graphviz` (if available)\n\n3. **Class: DependencyGenerator**\n   - **Methods:**\n     - `_safe_parse(content)`: Safely parses the given Python code content using `ast.parse()` and returns the resulting AST or `None` if parsing fails.\n     - `generateGraph(content)`: Generates a graph using `graphviz` to visualize the AST of the given Python code content. Skips graph generation if `graphviz` is not available.\n     - `extract_imports(content)`: Extracts import statements from the given Python code content and returns a list of imported modules or module aliases.\n     - `extract_functions(content)`: Extracts function definitions from the given Python code content and returns a list of dictionaries, where each dictionary represents a function with its name, arguments, return type, and docstring.\n     - `extract_classes(content)`: Extracts class definitions from the given Python code content and returns a list of dictionaries, where each dictionary represents a class with its name, bases, methods, and docstring.\n     - `extract_docstrings(content)`: Extracts the module-level docstring and per-symbol (functions and classes) docstrings from the given Python code content.\n     - `extract_type_hints(content)`: Extracts simple type hints from top-level functions in the given Python code content and returns a dictionary mapping function names to their argument and return type hints.\n     - `extract_top_level_constants(content)`: Extracts module-level simple constants (NAME = Constant) from the given Python code content and returns a list of dictionaries, where each dictionary represents a constant with its name and value.\n     - `extract_todos(content)`: Extracts TODO and FIXME comments from the given Python code content along with their line numbers.\n     - `summarize_file(content)`: Returns a combined summary dictionary for the given Python code content using the various extractor methods.\n     - `__init__()`: The constructor method for the `DependencyGenerator` class.\n\n4. **Usage:** The `DependencyGenerator` class can be used to analyze and extract various aspects of Python code, which can be useful for code analysis, documentation generation, or dependency management."}
