{"imports": ["os", "json"], "functions": [{"name": "clear_file", "args": ["self", "root_dir", "output_file"], "returns": null, "docstring": null}, {"name": "write_to_files", "args": ["self", "content", "output_file"], "returns": null, "docstring": null}, {"name": "write_to_json", "args": ["self", "content", "output_file"], "returns": null, "docstring": null}, {"name": "write_to_md", "args": ["self", "content", "output_file"], "returns": null, "docstring": null}, {"name": "readFiles", "args": ["self", "output_file"], "returns": "dict", "docstring": null}, {"name": "print_folder_not_found", "args": ["self", "path"], "returns": "bool", "docstring": null}, {"name": "getFiles", "args": ["self"], "returns": "list", "docstring": null}, {"name": "detect_language", "args": ["self", "filename"], "returns": "str", "docstring": null}, {"name": "get_manifest", "args": ["self"], "returns": "dict", "docstring": "Return a manifest of files under root_dir with metadata.\n\nManifest structure:\n{\n    \"relative/path.py\": {\n        \"path\": \"absolute/path\",\n        \"size\": 1234,\n        \"mtime\": 1234567890.0,\n        \"language\": \"python\"\n    },\n    ...\n}"}, {"name": "__init__", "args": ["self", "root_dir", "output_file", "ignore_folders", "ignore_files"], "returns": null, "docstring": null}], "classes": [{"name": "FileExplorer", "bases": [], "methods": ["clear_file", "write_to_files", "write_to_json", "write_to_md", "readFiles", "print_folder_not_found", "getFiles", "detect_language", "get_manifest", "__init__"], "docstring": null}], "docstrings": {"module": null, "functions": {"clear_file": null, "write_to_files": null, "write_to_json": null, "write_to_md": null, "readFiles": null, "print_folder_not_found": null, "getFiles": null, "detect_language": null, "get_manifest": "Return a manifest of files under root_dir with metadata.\n\nManifest structure:\n{\n    \"relative/path.py\": {\n        \"path\": \"absolute/path\",\n        \"size\": 1234,\n        \"mtime\": 1234567890.0,\n        \"language\": \"python\"\n    },\n    ...\n}", "__init__": null}, "classes": {"FileExplorer": null}}, "type_hints": {}, "constants": [], "file_name": "file_explorer_cli.py", "summary": "**Summary:**\n\nThe provided Python script defines a `FileExplorer` class with methods to interact with files and folders. Here's a summary of its functionality:\n\n1. **Initialization (`__init__`):**\n   - Takes `root_dir` (default is current working directory), `output_file` (default is \"output.txt\"), and lists of `ignore_folders` and `ignore_files`.\n   - Clears the output file upon initialization.\n\n2. **File and Folder Operations:**\n   - `clear_file(root_dir, output_file)`: Clears the specified output file in the given root directory.\n   - `write_to_files(content, output_file)`: Appends the given content to the specified output file in the root directory.\n   - `write_to_json(content, output_file)`: Writes the given content as JSON to the specified output file with a \".json\" extension.\n   - `write_to_md(content, output_file)`: Writes the given content as JSON to the specified output file with a \".md\" extension.\n   - `readFiles(output_file=\"read.txt\")`: Reads all files in the root directory (excluding ignored files and folders), returns a dictionary with file names as keys and their contents as values.\n   - `getFiles()`: Walks through the root directory, collects all non-ignored files, and writes their paths to the output file.\n\n3. **Helper Methods:**\n   - `print_folder_not_found(path)`: Prints an error message if the specified path (or root_dir if no path is given) is not a valid directory.\n   - `detect_language(filename)`: Determines the programming language based on the file extension.\n   - `get_manifest()`: Generates a manifest of files under the root directory with metadata (path, size, modification time, and detected language).\n\nThe `FileExplorer` class is designed to help explore, read, write, and manage files and folders in a specified root directory, while allowing for customization of ignored files and folders."}
